{
  "$schema": "http://json-schema.org/draft-07/schema#",
  "title": "spring-fleet configuration",
  "description": "Environment description for a fleet of multi-repo Spring Boot microservices. This file is private and must never be committed (see .gitignore).",
  "type": "object",
  "required": ["reposRoot", "buildTool", "logDir", "services"],
  "additionalProperties": true,
  "properties": {
    "reposRoot": {
      "type": "string",
      "description": "Absolute path to the directory containing all service and shared-lib repos."
    },
    "buildTool": {
      "type": "object",
      "required": ["type"],
      "properties": {
        "type": { "type": "string", "enum": ["gradle", "maven"] },
        "moduleFlag": {
          "type": "string",
          "description": "Template for building/running a single module. {module} is replaced by the module path. e.g. gradle: '-p {module}', maven: '-pl {module}'."
        },
        "run": { "type": "string", "description": "Task/goal to run a service locally. e.g. 'bootRun' or 'spring-boot:run'." },
        "test": { "type": "string", "description": "Task/goal to run tests. e.g. 'test'." }
      }
    },
    "logDir": {
      "type": "string",
      "description": "Absolute path to the directory where service logs are collected. One <service>.log per service."
    },
    "traceKeys": {
      "type": "array",
      "items": { "type": "string" },
      "description": "MDC keys that propagate across services and identify a single request/session. Order matters: the first key is the default correlation key. Recommended (2026): ['trace_id','span_id','sessionId','requestId']. trace_id/span_id are the Micrometer Observation / OpenTelemetry conventions (W3C traceparent, 32-hex / 16-hex lowercase), and sessionId/requestId are kept as legacy fallback."
    },
    "proxyLib": {
      "type": "string",
      "description": "Name of the generated inter-service client library (if any), used to follow service-to-service calls during tracing."
    },
    "sharedLibs": {
      "type": "array",
      "items": {
        "type": "object",
        "required": ["name", "path"],
        "properties": {
          "name": { "type": "string" },
          "path": { "type": "string", "description": "Path relative to reposRoot." },
          "modules": { "type": "array", "items": { "type": "string" } }
        }
      }
    },
    "services": {
      "type": "array",
      "minItems": 1,
      "items": {
        "type": "object",
        "required": ["name", "path"],
        "properties": {
          "name": { "type": "string", "description": "Short logical name, also used as the log file base name." },
          "path": { "type": "string", "description": "Path relative to reposRoot." },
          "port": { "type": "integer" },
          "contextPath": { "type": "string" },
          "logFile": { "type": "string", "description": "Log file name within logDir. Defaults to <name>.log." },
          "role": { "type": "string", "description": "Optional role marker, e.g. 'orchestrator'." },
          "backstage": {
            "type": "object",
            "description": "Lifted from a Backstage catalog-info.yaml at the repo root, when present. Provides ownership and lifecycle metadata; `dependsOn: component:*` entries are folded into topology.edges by scan_repos.py.",
            "additionalProperties": true,
            "properties": {
              "owner":     { "type": "string" },
              "system":    { "type": "string" },
              "lifecycle": { "type": "string" },
              "type":      { "type": "string" }
            }
          },
          "stack": {
            "type": "object",
            "description": "Detected stack features for this service. Produced by scan_repos.py at /fleet-init time; consumed by /run, the MCP tools, and agents to branch on what is actually deployed.",
            "additionalProperties": true,
            "properties": {
              "springBootMajor": { "type": ["integer", "null"], "description": "Major Spring Boot version (3 or 4) derived from the build file." },
              "java": { "type": ["integer", "null"], "description": "Java toolchain version (e.g. 17, 21, 25)." },
              "virtualThreads": { "type": "boolean", "description": "spring.threads.virtual.enabled=true is set." },
              "graalNative": { "type": "boolean", "description": "GraalVM native-image plugin is applied (cold-start path)." },
              "dockerCompose": { "type": "boolean", "description": "A compose.yaml / docker-compose.yaml is present at the repo root (Spring Boot Docker Compose support)." },
              "testcontainers": { "type": "boolean", "description": "Testcontainers @ServiceConnection or starter is used (modern local dev pattern)." },
              "opentelemetry": { "type": "boolean", "description": "OpenTelemetry starter or Micrometer Tracing OTel bridge is on the classpath." }
            }
          }
        }
      }
    },
    "k8s": {
      "type": "object",
      "description": "Optional Kubernetes mode. When present, /logs falls back to `kubectl logs` for any service that has no file-based log under logDir. mirrord users can run a single local service against the shared cluster and still get cross-service correlation via this config (the cluster-side services log to stdout, which kubectl reads).",
      "additionalProperties": true,
      "properties": {
        "namespace": { "type": "string", "description": "Kubernetes namespace where the fleet runs." },
        "context":   { "type": "string", "description": "kubectl context name. Defaults to the active context." },
        "podSelectorTemplate": {
          "type": "string",
          "description": "Label selector template used by `kubectl logs -l <expanded>`. {service} is replaced by the service name. e.g. 'app.kubernetes.io/name={service}'."
        }
      }
    },
    "topology": {
      "type": "object",
      "description": "The request call-chain across services.",
      "properties": {
        "entry": { "type": "array", "items": { "type": "string" }, "description": "Service names that receive external requests." },
        "edges": {
          "type": "array",
          "items": {
            "type": "array",
            "items": { "type": "string" },
            "minItems": 2,
            "maxItems": 2
          },
          "description": "Directed [from, to] service-name pairs describing who calls whom."
        }
      }
    }
  }
}
